text,category
"Please help, Health card not accepted. please guide",Healthcare Access
Bhai Nala block hai complaint karni hai. help me,Municipal Issue
Madam मुझे मुफ्त कानूनी सहायता चाहिए। what should I do?,Legal Aid
Madam Clinic overcharged me for treatment. what should I do?,Healthcare Access
Madam Tell me a joke. please guide,Unknown
"Urgent, Ration card not approved. help me",Government Scheme
Bhai Doctor refused to treat patient.,Healthcare Access
Madam Write a poem about rain. kaise solve hoga?,Unknown
Bhai Boss ne payment rok diya hai. please guide,Labour Dispute
"Please help, Legal services authority contact kaise kare? what should I do?",Legal Aid
Sir Fake product mila online order mein. complaint kaha karu?,Consumer Complaint
Madam Fraud hua hai police complaint karni hai. complaint kaha karu?,Police Complaint
Madam Shopkeeper is refusing to replace defective product.,Consumer Complaint
Bhai Seller sent wrong product and is ignoring me.,Consumer Complaint
Madam Hospital denied treatment. complaint kaha karu?,Healthcare Access
Sir Tenant ko ghar se nikal rahe hain. complaint kaha karu?,Property Issue
I need court help but cannot pay lawyer fees. help me,Legal Aid
Sir Shopkeeper is refusing to replace defective product. help me,Consumer Complaint
Sir मेरा मोबाइल चोरी हो गया है। help me,Police Complaint
"Please help, How can I get FIR copy? complaint kaha karu?",Police Complaint
"Please help, I am facing domestic violence at home. kaise solve hoga?",Domestic Violence / Safety
Madam Someone is blackmailing me online. kaise solve hoga?,Police Complaint
Bhai I feel unsafe at home. help me,Domestic Violence / Safety
Bhai मुझे three months से वेतन नहीं मिला है। kaise solve hoga?,Labour Dispute
"Urgent, I want to file a police complaint. please guide",Police Complaint
My in-laws are abusing me for dowry. complaint kaha karu?,Domestic Violence / Safety
Sir Aadhaar update problem. complaint kaha karu?,Government Scheme
Sir What is the weather today?,Unknown
Bhai Partner ne mujhe beat kiya hai. kaise solve hoga?,Domestic Violence / Safety
Bhai मेरा सामान खराब आया है और कंपनी बदल नहीं रही।,Consumer Complaint
Madam I want to learn Python. please guide,Unknown
I worked but did not receive payment. help me,Labour Dispute
Bhai Someone is blackmailing me online. please guide,Police Complaint
Sir DLSA se help kaise milegi? kaise solve hoga?,Legal Aid
"Please help, Clinic overcharged me for treatment. complaint kaha karu?",Healthcare Access
Municipal complaint kaha kare? please guide,Municipal Issue
"Urgent, Delivery not received but money got deducted. kaise solve hoga?",Consumer Complaint
Sir Ambulance nahi mil rahi hai. what should I do?,Healthcare Access
"Please help, Can poor people get free legal support? complaint kaha karu?",Legal Aid
Bhai Can poor people get free legal support?,Legal Aid
"Urgent, Tell me a joke. help me",Unknown
Sir My employer has not paid my salary for one month. what should I do?,Labour Dispute
मुझे मुफ्त कानूनी सहायता चाहिए।,Legal Aid
Sir Drainage problem in my street.,Municipal Issue
Madam Landlord not returning security deposit. complaint kaha karu?,Property Issue
Madam Drainage problem in my street. complaint kaha karu?,Municipal Issue
My service request is pending for long time. complaint kaha karu?,Public Grievance
"Please help, Public toilet is very dirty. complaint kaha karu?",Municipal Issue
Madam Government benefit has not been received. complaint kaha karu?,Government Scheme
Sir I bought shoes online and seller is not giving refund. what should I do?,Consumer Complaint
Sir Domicile certificate reject ho gaya. what should I do?,Government Scheme
Sir How to cook pasta? what should I do?,Unknown
Tell me a joke. please guide,Unknown
"Please help, सरकारी योजना का लाभ नहीं मिला। help me",Government Scheme
"Urgent, Who won the cricket match? complaint kaha karu?",Unknown
"Please help, Caste certificate pending for months. please guide",Government Scheme
Sir My landlord is forcing me to leave. complaint kaha karu?,Property Issue
"Please help, Application number hai but no update. please guide",Public Grievance
"Please help, I want to learn Python. please guide",Unknown
"Please help, Water supply is dirty in my area. kaise solve hoga?",Municipal Issue
Suggest a good phone under 20000.,Unknown
"Please help, Boss ne payment rok diya hai. kaise solve hoga?",Labour Dispute
Mera phone chori ho gaya hai. please guide,Police Complaint
Sir I am facing domestic violence at home. help me,Domestic Violence / Safety
Madam Mosquito problem due to sewage. help me,Municipal Issue
Subsidy not received. kaise solve hoga?,Government Scheme
Sir Where can I get free legal aid? help me,Legal Aid
"Please help, Mosquito problem due to sewage.",Municipal Issue
"Urgent, Lease dispute with house owner. please guide",Property Issue
Shopkeeper is refusing to replace defective product. complaint kaha karu?,Consumer Complaint
"Urgent, Fraud hua hai police complaint karni hai. what should I do?",Police Complaint
I feel unsafe at home. help me,Domestic Violence / Safety
"Urgent, मकान मालिक जबरदस्ती निकाल रहा है। complaint kaha karu?",Property Issue
Bhai My company fired me without paying dues.,Labour Dispute
"Urgent, Where can I get free legal aid? please guide",Legal Aid
Sir Landlord not returning security deposit. complaint kaha karu?,Property Issue
"Please help, गली में कचरा पड़ा है। please guide",Municipal Issue
Bhai मेरे पति मुझे धमकी दे रहे हैं। complaint kaha karu?,Domestic Violence / Safety
Sir What is the weather today? what should I do?,Unknown
Who won the cricket match? what should I do?,Unknown
"Urgent, Health card not accepted. complaint kaha karu?",Healthcare Access
Sir Illegal occupation of my land. what should I do?,Property Issue
"Urgent, Ambulance nahi mil rahi hai.",Healthcare Access
Bhai मुझे अस्पताल में भर्ती नहीं कर रहे। kaise solve hoga?,Healthcare Access
Madam I need court help but cannot pay lawyer fees. kaise solve hoga?,Legal Aid
"Please help, There is violence in my house and I need help. kaise solve hoga?",Domestic Violence / Safety
"Urgent, I need advocate help but have no money. kaise solve hoga?",Legal Aid
Madam My employer has not paid my salary for many weeks.,Labour Dispute
"Please help, I am afraid to go back home. please guide",Domestic Violence / Safety
NALSA legal aid ke liye apply kaise kare? kaise solve hoga?,Legal Aid
Warranty claim rejected without proper reason. what should I do?,Consumer Complaint
Madam Someone is stalking me daily.,Domestic Violence / Safety
"Urgent, Public service delivery problem. please guide",Public Grievance
Madam Someone is stalking me daily. what should I do?,Domestic Violence / Safety
Sir Can poor people get free legal support? kaise solve hoga?,Legal Aid
"Please help, Someone threatened me and I want police help. what should I do?",Police Complaint
"Please help, Who won the cricket match? help me",Unknown
Madam Aadhaar update problem. complaint kaha karu?,Government Scheme
Madam Someone threatened me and I want police help. complaint kaha karu?,Police Complaint
Sir There is garbage near my house. complaint kaha karu?,Municipal Issue
Madam What is the weather today? help me,Unknown
Sir Someone is stalking me daily.,Domestic Violence / Safety
Sir Shopkeeper is refusing to replace defective product. complaint kaha karu?,Consumer Complaint
Sir Clinic overcharged me for treatment. help me,Healthcare Access
Bhai Illegal occupation of my land.,Property Issue
Bhai Legal services authority contact kaise kare? help me,Legal Aid
Madam Medicine not available in government hospital. help me,Healthcare Access
"Urgent, मुझे three months से वेतन नहीं मिला है। kaise solve hoga?",Labour Dispute
Madam CPGRAMS complaint kaise kare? help me,Public Grievance
Madam Officer is not taking action on complaint. kaise solve hoga?,Public Grievance
Bhai Someone is blackmailing me online. please guide,Police Complaint
"Urgent, Government hospital refused admission. what should I do?",Healthcare Access
Sir NALSA legal aid ke liye apply kaise kare?,Legal Aid
Explain machine learning. help me,Unknown
Sir My bike was stolen yesterday.,Police Complaint
Bhai Public service delivery problem. complaint kaha karu?,Public Grievance
"Please help, My company fired me without paying dues. what should I do?",Labour Dispute
Madam Product defective hai aur replacement nahi mil raha. what should I do?,Consumer Complaint
I want to learn Python. please guide,Unknown
"Urgent, मकान मालिक जबरदस्ती निकाल रहा है। kaise solve hoga?",Property Issue
Bhai Aadhaar update problem. kaise solve hoga?,Government Scheme
"Urgent, Caste certificate pending for months.",Government Scheme
Bhai I am afraid to go back home. kaise solve hoga?,Domestic Violence / Safety
Madam Explain machine learning. complaint kaha karu?,Unknown
Warranty claim rejected without proper reason.,Consumer Complaint
Sir I need court help but cannot pay lawyer fees. what should I do?,Legal Aid
"Please help, Mujhe free lawyer chahiye.",Legal Aid
Bhai Ration card not approved. complaint kaha karu?,Government Scheme
Madam How to cook pasta?,Unknown
Madam I am facing domestic violence at home. please guide,Domestic Violence / Safety
"Please help, Drainage problem in my street. complaint kaha karu?",Municipal Issue
Sir CPGRAMS complaint kaise kare?,Public Grievance
Bhai Domicile certificate reject ho gaya. what should I do?,Government Scheme
"Urgent, I am afraid to go back home. complaint kaha karu?",Domestic Violence / Safety
"Urgent, Fraud hua hai police complaint karni hai. what should I do?",Police Complaint
"Please help, Mera phone chori ho gaya hai. kaise solve hoga?",Police Complaint
I cannot afford a lawyer. complaint kaha karu?,Legal Aid
Boss ne payment rok diya hai. complaint kaha karu?,Labour Dispute
"Urgent, My pension application is pending. please guide",Government Scheme
"Urgent, Someone is stalking me daily.",Domestic Violence / Safety
"Please help, Legal services authority contact kaise kare? help me",Legal Aid
Bhai Nala block hai complaint karni hai. kaise solve hoga?,Municipal Issue
Madam Health card not accepted. complaint kaha karu?,Healthcare Access
"Urgent, Explain machine learning. kaise solve hoga?",Unknown
Bhai I need advocate help but have no money. help me,Legal Aid
"Urgent, Ambulance nahi mil rahi hai.",Healthcare Access
"Please help, Write a poem about rain.",Unknown
Sir Mosquito problem due to sewage. help me,Municipal Issue
Sir Subsidy not received. kaise solve hoga?,Government Scheme
"Urgent, Drainage problem in my street. please guide",Municipal Issue
"Please help, मेरे पति मुझे धमकी दे रहे हैं। complaint kaha karu?",Domestic Violence / Safety
Bhai Officer is not taking action on complaint. please guide,Public Grievance
Sir Factory owner is not giving wages. please guide,Labour Dispute
Madam Rent agreement issue.,Property Issue
"Please help, DLSA se help kaise milegi?",Legal Aid
Madam What is the weather today? please guide,Unknown
Bhai I bought laptop online and seller is not giving refund.,Consumer Complaint
"Please help, मुझे अस्पताल में भर्ती नहीं कर रहे।",Healthcare Access
"Please help, What is the weather today? please guide",Unknown
Madam Product defective hai aur replacement nahi mil raha. kaise solve hoga?,Consumer Complaint
Madam Medicine not available in government hospital. please guide,Healthcare Access
Sir Who won the cricket match? help me,Unknown
"Please help, Illegal occupation of my land. what should I do?",Property Issue
"Please help, I want to file a police complaint. what should I do?",Police Complaint
Sir Patient ko emergency ward me nahi liya. kaise solve hoga?,Healthcare Access
"Please help, Partner ne mujhe beat kiya hai. what should I do?",Domestic Violence / Safety
"Please help, Illegal occupation of my land.",Property Issue
"Please help, सरकारी योजना का लाभ नहीं मिला। what should I do?",Government Scheme
Bhai My in-laws are abusing me for dowry. what should I do?,Domestic Violence / Safety
Can poor people get free legal support? complaint kaha karu?,Legal Aid
Madam Scholarship nahi mili. please guide,Government Scheme
"Urgent, I am afraid to go back home. what should I do?",Domestic Violence / Safety
Sir I need court help but cannot pay lawyer fees. what should I do?,Legal Aid
Madam Officer is not taking action on complaint. complaint kaha karu?,Public Grievance
My bike was stolen yesterday. what should I do?,Police Complaint
"Urgent, What is the weather today? complaint kaha karu?",Unknown
Bhai Pati mujhe maar raha hai. kaise solve hoga?,Domestic Violence / Safety
"Urgent, Someone is blackmailing me online. kaise solve hoga?",Police Complaint
"Urgent, Aadhaar update problem. complaint kaha karu?",Government Scheme
Bhai Write a poem about rain. kaise solve hoga?,Unknown
Madam Water supply is dirty in my area. help me,Municipal Issue
Sir Mujhe free lawyer chahiye. help me,Legal Aid
"Urgent, Builder has not given flat possession. help me",Property Issue
Bhai I bought watch online and seller is not giving refund.,Consumer Complaint
"Urgent, CPGRAMS complaint kaise kare?",Public Grievance
Bhai There is garbage near my house. kaise solve hoga?,Municipal Issue
"Urgent, मुझे अस्पताल में भर्ती नहीं कर रहे। help me",Healthcare Access
Bhai Government office me complaint kaha kare?,Public Grievance
Ayushman card se treatment nahi mila. complaint kaha karu?,Healthcare Access
"Please help, सरकारी विभाग जवाब नहीं दे रहा। what should I do?",Public Grievance
Madam I worked but did not receive payment. kaise solve hoga?,Labour Dispute
Madam Land dispute with neighbour. help me,Property Issue
मुझे अस्पताल में भर्ती नहीं कर रहे। kaise solve hoga?,Healthcare Access
Madam Landlord not returning security deposit. help me,Property Issue
"Please help, मुझे मुफ्त कानूनी सहायता चाहिए। help me",Legal Aid
"Urgent, Tenant ko ghar se nikal rahe hain. complaint kaha karu?",Property Issue
Bhai Medicine not available in government hospital.,Healthcare Access
"Please help, Company salary nahi de rahi hai for two months.",Labour Dispute
Sir मुझे मुफ्त कानूनी सहायता चाहिए। complaint kaha karu?,Legal Aid
My in-laws are abusing me for dowry. kaise solve hoga?,Domestic Violence / Safety
Bhai Pati mujhe maar raha hai. complaint kaha karu?,Domestic Violence / Safety
"Please help, Warranty claim rejected without proper reason.",Consumer Complaint
Landlord not returning security deposit. please guide,Property Issue
"Please help, Government department is delaying my application. what should I do?",Public Grievance
"Urgent, Road has big potholes. what should I do?",Municipal Issue
Bhai Order cancel hua but refund nahi aaya. what should I do?,Consumer Complaint
Madam There is violence in my house and I need help.,Domestic Violence / Safety
Bhai My landlord is forcing me to leave. help me,Property Issue
Madam Department complaint portal me grievance file karna hai. help me,Public Grievance
"Urgent, Public toilet is very dirty. complaint kaha karu?",Municipal Issue
Mosquito problem due to sewage.,Municipal Issue
Madam Service center is not repairing my watch. kaise solve hoga?,Consumer Complaint
I want to report cyber crime. complaint kaha karu?,Police Complaint
CPGRAMS complaint kaise kare? help me,Public Grievance
Madam Order cancel hua but refund nahi aaya. what should I do?,Consumer Complaint
Bhai My company fired me without paying dues. please guide,Labour Dispute
"Urgent, My in-laws are abusing me for dowry.",Domestic Violence / Safety
"Please help, Suggest a good phone under 20000. help me",Unknown
Madam Officer is not taking action on complaint. please guide,Public Grievance
Bhai Pati mujhe maar raha hai. complaint kaha karu?,Domestic Violence / Safety
"Please help, Road has big potholes. kaise solve hoga?",Municipal Issue
Service center is not repairing my shoes. kaise solve hoga?,Consumer Complaint
Madam Tenant ko ghar se nikal rahe hain. help me,Property Issue
Sir There is garbage near my house. kaise solve hoga?,Municipal Issue
"Urgent, Employer is delaying my salary again. help me",Labour Dispute
Bhai Property registry problem.,Property Issue
"Urgent, Subsidy not received. complaint kaha karu?",Government Scheme
Madam Seller sent wrong product and is ignoring me.,Consumer Complaint
Bhai Government hospital refused admission.,Healthcare Access
Bhai Scholarship nahi mili. what should I do?,Government Scheme
"Urgent, Landlord not returning security deposit. help me",Property Issue
Sir मुझे many weeks से वेतन नहीं मिला है। kaise solve hoga?,Labour Dispute
"Please help, PF amount company ne nahi diya. please guide",Labour Dispute
Bhai There is violence in my house and I need help. kaise solve hoga?,Domestic Violence / Safety
Landlord not returning security deposit. kaise solve hoga?,Property Issue
"Urgent, Factory owner is not giving wages. what should I do?",Labour Dispute
Madam Employer is delaying my salary again.,Labour Dispute
"Please help, गली में कचरा पड़ा है। help me",Municipal Issue
Sir Write a poem about rain. please guide,Unknown
"Please help, Mera phone chori ho gaya hai.",Police Complaint
"Please help, Who won the cricket match?",Unknown
"Urgent, Public authority is not responding. help me",Public Grievance
My employer has not paid my salary for six months.,Labour Dispute
Public authority is not responding. kaise solve hoga?,Public Grievance
Department complaint portal me grievance file karna hai. complaint kaha karu?,Public Grievance
Madam सरकारी विभाग जवाब नहीं दे रहा। what should I do?,Public Grievance
Bhai Public toilet is very dirty. complaint kaha karu?,Municipal Issue
Can poor people get free legal support? complaint kaha karu?,Legal Aid
DLSA se help kaise milegi? help me,Legal Aid
Bhai Delivery not received but money got deducted. complaint kaha karu?,Consumer Complaint
Shopkeeper is refusing to replace defective product. what should I do?,Consumer Complaint
"Please help, Tell me a joke. kaise solve hoga?",Unknown
Road has big potholes. help me,Municipal Issue
"Please help, What is the weather today?",Unknown
"Please help, Play some music. help me",Unknown
What is the capital of Japan? help me,Unknown
Madam I want to file a police complaint. help me,Police Complaint
How to cook pasta?,Unknown
Bhai Ayushman card se treatment nahi mila. help me,Healthcare Access
Bhai Doctor refused to treat patient. please guide,Healthcare Access
Madam Caste certificate pending for months. complaint kaha karu?,Government Scheme
Sir Nala block hai complaint karni hai.,Municipal Issue
Madam Subsidy not received.,Government Scheme
"Urgent, Mujhe free lawyer chahiye. kaise solve hoga?",Legal Aid
Bhai Police station complaint kaise kare? what should I do?,Police Complaint
Sir My employer has not paid my salary for two months. kaise solve hoga?,Labour Dispute
Scholarship nahi mili. help me,Government Scheme
"Please help, Medicine not available in government hospital. kaise solve hoga?",Healthcare Access
Bhai मकान मालिक जबरदस्ती निकाल रहा है। help me,Property Issue
Service center is not repairing my laptop.,Consumer Complaint
"Please help, Service center is not repairing my washing machine. complaint kaha karu?",Consumer Complaint
Sir Someone is stalking me daily. what should I do?,Domestic Violence / Safety
Sir सरकारी योजना का लाभ नहीं मिला। complaint kaha karu?,Government Scheme
My service request is pending for long time. kaise solve hoga?,Public Grievance
Bhai Overtime ka paisa nahi mila. kaise solve hoga?,Labour Dispute
Bhai PF amount company ne nahi diya. please guide,Labour Dispute
"Urgent, Police station complaint kaise kare?",Police Complaint
Bhai Government department is delaying my application. help me,Public Grievance
Bhai Health card not accepted. please guide,Healthcare Access
"Please help, Illegal occupation of my land. kaise solve hoga?",Property Issue
Fake product mila online order mein. what should I do?,Consumer Complaint
"Urgent, Police station complaint kaise kare? kaise solve hoga?",Police Complaint
मकान मालिक जबरदस्ती निकाल रहा है। kaise solve hoga?,Property Issue
I am facing domestic violence at home. complaint kaha karu?,Domestic Violence / Safety
Scholarship nahi mili. help me,Government Scheme
"Please help, Legal services authority contact kaise kare?",Legal Aid
Madam मेरा मोबाइल चोरी हो गया है। help me,Police Complaint
"Please help, Explain machine learning. what should I do?",Unknown
Madam Order cancel hua but refund nahi aaya. complaint kaha karu?,Consumer Complaint
Madam Property registry problem. help me,Property Issue
"Urgent, Factory owner is not giving wages. kaise solve hoga?",Labour Dispute
Bhai Explain machine learning. complaint kaha karu?,Unknown
Bhai My bike was stolen yesterday. please guide,Police Complaint
Public authority is not responding. kaise solve hoga?,Public Grievance
Play some music. what should I do?,Unknown
Sir Pati mujhe maar raha hai. what should I do?,Domestic Violence / Safety
"Urgent, I want to learn Python. please guide",Unknown
I want to file a police complaint.,Police Complaint
"Please help, Fraud hua hai police complaint karni hai. please guide",Police Complaint
"Urgent, Government department is delaying my application.",Public Grievance
Sir Government hospital refused admission. help me,Healthcare Access
"Please help, PF amount company ne nahi diya.",Labour Dispute
Bhai Medicine not available in government hospital. help me,Healthcare Access
"Please help, Health card not accepted. what should I do?",Healthcare Access
My employer has not paid my salary for many weeks. please guide,Labour Dispute
Bhai Hospital denied treatment. help me,Healthcare Access
Sir Suggest a good phone under 20000. complaint kaha karu?,Unknown
Bhai मेरा सामान खराब आया है और कंपनी बदल नहीं रही। please guide,Consumer Complaint
"Please help, Service center is not repairing my phone. what should I do?",Consumer Complaint
"Urgent, I worked but did not receive payment. complaint kaha karu?",Labour Dispute
"Please help, My husband is threatening me and I am scared. please guide",Domestic Violence / Safety
Bhai Medicine not available in government hospital. kaise solve hoga?,Healthcare Access
"Please help, Drainage problem in my street. help me",Municipal Issue
Rent agreement issue. complaint kaha karu?,Property Issue
"Please help, Municipal complaint kaha kare?",Municipal Issue
Fake product mila online order mein. kaise solve hoga?,Consumer Complaint
"Please help, I cannot afford a lawyer. help me",Legal Aid
Madam I want to file a police complaint. help me,Police Complaint
"Urgent, Fraud hua hai police complaint karni hai. kaise solve hoga?",Police Complaint
"Urgent, I am facing domestic violence at home. complaint kaha karu?",Domestic Violence / Safety
Sir Overtime ka paisa nahi mila. kaise solve hoga?,Labour Dispute
Sir Shopkeeper is refusing to replace defective product. what should I do?,Consumer Complaint
Bhai Ayushman card se treatment nahi mila. kaise solve hoga?,Healthcare Access
"Please help, Someone is blackmailing me online. what should I do?",Police Complaint
Health card not accepted. kaise solve hoga?,Healthcare Access
Madam What is the capital of Japan? complaint kaha karu?,Unknown
Sir Lease dispute with house owner. complaint kaha karu?,Property Issue
Bhai Shopkeeper is refusing to replace defective product. what should I do?,Consumer Complaint
"Urgent, I am facing domestic violence at home. what should I do?",Domestic Violence / Safety
Madam Hospital denied treatment. please guide,Healthcare Access
Patient ko emergency ward me nahi liya. complaint kaha karu?,Healthcare Access
"Urgent, Tenant ko ghar se nikal rahe hain. help me",Property Issue
Sir Ayushman card se treatment nahi mila. help me,Healthcare Access
Sir Factory owner is not giving wages. complaint kaha karu?,Labour Dispute
Madam Warranty claim rejected without proper reason. what should I do?,Consumer Complaint
"Urgent, Partner ne mujhe beat kiya hai. kaise solve hoga?",Domestic Violence / Safety
"Urgent, Caste certificate pending for months. complaint kaha karu?",Government Scheme
Madam Streetlight is not working. what should I do?,Municipal Issue
"Urgent, Delivery not received but money got deducted.",Consumer Complaint
I feel unsafe at home. kaise solve hoga?,Domestic Violence / Safety
Subsidy not received. complaint kaha karu?,Government Scheme
"Urgent, Partner ne mujhe beat kiya hai. help me",Domestic Violence / Safety
"Urgent, Scholarship nahi mili. help me",Government Scheme
Madam I want to report cyber crime. what should I do?,Police Complaint
Madam Boss ne payment rok diya hai. help me,Labour Dispute
"Urgent, Can poor people get free legal support? kaise solve hoga?",Legal Aid
